{
  "reasoningId": "reasoning-channel-b-001",
  "state": "completed",
  "title": "深度思考",
  "statusLabel": "已完成",
  "statusTone": "Good",
  "timerText": "用时 12 秒 · 3 段推理 · 13 次工具调用",
  "traceExpanded": false,
  "traceCollapsed": true,
  "collapsedSummary": "已思考 12 秒",
  "phases": [
    {
      "thought": "先把渠道 B 转化下降的范围圈出来：拆成线索、试用激活、付费三段漏斗，取近 90 天数据。",
      "actions": [
        {
          "tool": "query_metrics",
          "detail": "channel=B · range=90d · group=stage",
          "statusGlyph": "●",
          "statusTone": "Good"
        },
        {
          "tool": "read_file",
          "detail": "~/analytics/funnel_definition.sql · ×2",
          "statusGlyph": "●",
          "statusTone": "Good"
        },
        {
          "tool": "run_sql",
          "detail": "按漏斗阶段汇总数量与转化率",
          "statusGlyph": "●",
          "statusTone": "Good"
        }
      ]
    },
    {
      "thought": "激活率的降幅高于线索量，交叉核验行业结构、客服工单、NPS 与季节性。",
      "actions": [
        {
          "tool": "query_metrics",
          "detail": "按行业拆分激活率",
          "statusGlyph": "●",
          "statusTone": "Good"
        },
        {
          "tool": "run_sql",
          "detail": "对比各行业激活与付费转化",
          "statusGlyph": "●",
          "statusTone": "Good"
        },
        {
          "tool": "search_tickets",
          "detail": "渠道 B · 试用 / 激活失败 · 近 60 天",
          "statusGlyph": "●",
          "statusTone": "Good"
        },
        {
          "tool": "read_file",
          "detail": "~/nps/2026Q2_channelB.csv",
          "statusGlyph": "●",
          "statusTone": "Good"
        },
        {
          "tool": "query_metrics",
          "detail": "叠加节假日与季节性校正",
          "statusGlyph": "●",
          "statusTone": "Good"
        },
        {
          "tool": "run_sql",
          "detail": "逐周复核线索与激活数量",
          "statusGlyph": "●",
          "statusTone": "Good"
        },
        {
          "tool": "web_search",
          "detail": "SaaS 行业 2026 试用政策调整",
          "statusGlyph": "●",
          "statusTone": "Good"
        }
      ]
    },
    {
      "thought": "主因确认：教育与专业服务合计贡献 63% 降幅，激活断点集中在试用权益触达。",
      "actions": [
        {
          "tool": "run_sql",
          "detail": "按行业汇总转化降幅贡献",
          "statusGlyph": "●",
          "statusTone": "Good"
        },
        {
          "tool": "edit_file",
          "detail": "~/reports/channelB_rootcause.md · 已编辑",
          "statusGlyph": "●",
          "statusTone": "Good"
        },
        {
          "tool": "think",
          "detail": "拆分行业漏斗深挖与权益触达复盘",
          "statusGlyph": "●",
          "statusTone": "Good"
        }
      ]
    }
  ]
}
