{
  "reasoningId": "reasoning-channel-b-001",
  "state": "answering",
  "title": "已深度思考",
  "statusLabel": "回答中",
  "statusTone": "Accent",
  "timerText": "正在生成回答…",
  "traceExpanded": true,
  "traceCollapsed": false,
  "collapsedSummary": "推理已完成 · 回答正在生成",
  "progressText": "推理已完成，正在生成回答…",
  "phases": [
    {
      "thought": "先拆分线索、试用激活与付费三段漏斗，核对近 90 天数据。",
      "actions": [
        {
          "tool": "query_metrics",
          "detail": "channel=B · range=90d · group=stage",
          "statusGlyph": "●",
          "statusTone": "Good"
        },
        {
          "tool": "read_file",
          "detail": "~/analytics/funnel_definition.sql · ×2",
          "statusGlyph": "●",
          "statusTone": "Good"
        },
        {
          "tool": "run_sql",
          "detail": "按漏斗阶段汇总数量与转化率",
          "statusGlyph": "●",
          "statusTone": "Good"
        }
      ]
    },
    {
      "thought": "激活率的降幅高于线索量，交叉核验行业结构、客服工单、NPS 与季节性。",
      "actions": [
        {
          "tool": "query_metrics",
          "detail": "按行业拆分激活率",
          "statusGlyph": "●",
          "statusTone": "Good"
        },
        {
          "tool": "search_tickets",
          "detail": "渠道 B · 试用 / 激活失败 · 近 60 天",
          "statusGlyph": "●",
          "statusTone": "Good"
        },
        {
          "tool": "read_file",
          "detail": "~/nps/2026Q2_channelB.csv",
          "statusGlyph": "●",
          "statusTone": "Good"
        },
        {
          "tool": "query_metrics",
          "detail": "叠加节假日与季节性校正",
          "statusGlyph": "●",
          "statusTone": "Good"
        }
      ]
    },
    {
      "thought": "主因确认：教育与专业服务合计贡献 63% 降幅，激活断点集中在试用权益触达。",
      "actions": [
        {
          "tool": "run_sql",
          "detail": "按行业汇总转化降幅贡献",
          "statusGlyph": "●",
          "statusTone": "Good"
        },
        {
          "tool": "edit_file",
          "detail": "~/reports/channelB_rootcause.md · 已编辑",
          "statusGlyph": "●",
          "statusTone": "Good"
        },
        {
          "tool": "think",
          "detail": "正在组织结论、证据与下周建议…",
          "statusGlyph": "●",
          "statusTone": "Accent"
        }
      ]
    }
  ]
}
